query,answer,timestamp,rating
hi,I'm here to support you. Could you provide more details about what you're experiencing?,2026-03-07 21:59:35.391496,
hi,I'm here to support you. Could you provide more details about what you're experiencing?,2026-03-07 21:59:41.048508,
i m feeling sad,"a normal reaction to a loss, disappointment, problems, or other difficult situations. Feeling sad from time to time is just another part of being human. In these cases, feelings of sadness go away quickly and you can go about your daily life. Other ways to talk about sadness might be ‘f... FAQ 2: How can I use distraction to manage difficult thoughts or feelings? - Distraction is a very valid tool to help you cope when everything feels overwhelming or when you feel lonely or isolated. If you don’t have a lot of energy or focus right now, try low-effort distractions like watching TV, browsing Youtube, listening to a podcast or audiobook, playing a game on you...",2026-03-07 22:00:03.599260,
"i am unable to forget someone, and remembering them gives me panic attacks","I am unable to forget someone, and remembering them gives me panic attacks",2026-03-07 22:01:04.804887,
"i am unable to forget someone, and remembering them gives me panic attacks","I am unable to forget someone, and remembering them gives me panic attacks",2026-03-07 22:01:14.244589,1.0
